{
  "$schema": "https://hyperpolymath.dev/standards/cartridges/cartridge-v1.json",
  "spdx": "MPL-2.0",
  "copyright": "Copyright (c) 2026 Jonathan D.A. Jewell (hyperpolymath)",
  "name": "bug-filing-mcp",
  "version": "0.2.0",
  "description": "Autonomous bug-report filing cartridge -- wraps the real feedback-o-tron engine (multi-forge issue submission with deduplication and audit logging) via its localhost HTTP intake. v0.2 exposes the engine's full interactive loop: research_feedback (search existing issues + the target repo's template questions, so duplicates are avoided), synthesize_feedback (intent classification with a usefulness-first gate, template hydration, open questions back to the caller), and submit_feedback (now accepting validated template_data). This is the boj-side packaging of the engine for the autonomous bug-reporting pipeline (feedback-o-tron/docs/AUTONOMOUS-BUG-PIPELINE.adoc, D0 = new wrapping cartridge). NOT the same as feedback-mcp, which is an unrelated in-memory sentiment counter.",
  "domain": "development",
  "category": "domain",
  "tier": "Teranga",
  "protocols": [
    "MCP",
    "REST"
  ],
  "auth": {
    "method": "none",
    "env_var": null,
    "credential_source": null
  },
  "api": {
    "base_url": "http://127.0.0.1:7722",
    "content_type": "application/json"
  },
  "tools": [
    {
      "name": "research_feedback",
      "description": "Research existing feedback before filing: searches the target forge for similar issues (scored by title similarity), checks the engine's local dedup index (with recurrence stats), and returns the repo's issue-form questions -- so duplicates are avoided and refinement is interactive. Call this first.",
      "inputSchema": {
        "type": "object",
        "properties": {
          "repo": {
            "type": "string",
            "description": "Target repository (owner/repo)"
          },
          "title": {
            "type": "string",
            "description": "Working title / one-line summary of the feedback"
          },
          "body": {
            "type": "string",
            "description": "Optional draft body to improve similarity matching"
          },
          "limit": {
            "type": "integer",
            "description": "Max forge matches to return (default 5, max 20)"
          },
          "include_templates": {
            "type": "boolean",
            "description": "Also fetch the repo's issue-form templates (default true)"
          }
        },
        "required": ["repo", "title"]
      }
    },
    {
      "name": "synthesize_feedback",
      "description": "Shape raw feedback into a report fit for the receiver: classifies intent (usefulness-first -- zero-signal abuse is rejected with a stated reason; mixed content has its actionable core salvaged and the stripping reported), fetches the target repo's issue-form template, hydrates its fields from context and system state, and returns a draft plus the open questions still needed. Resolve the open questions with your user, then call submit_feedback with the completed template_data.",
      "inputSchema": {
        "type": "object",
        "properties": {
          "raw_feedback": {
            "type": "string",
            "description": "The raw feedback/crash text to shape into a report"
          },
          "repo": {
            "type": "string",
            "description": "Target repository (owner/repo)"
          },
          "context": {
            "type": "object",
            "description": "Caller-provided context: title, version, expected, trajectory, logs"
          },
          "system_state": {
            "type": "object",
            "description": "Caller-provided environment facts (OS, runtime versions)"
          },
          "template": {
            "type": "string",
            "description": "Force a specific template file (e.g. bug.yml)"
          },
          "network_probe": {
            "type": "boolean",
            "description": "Run NetworkVerifier preflight when the report looks network-related (default false)"
          }
        },
        "required": ["raw_feedback", "repo"]
      }
    },
    {
      "name": "submit_feedback",
      "description": "File a bug report / feedback / proposal to one or more forges (GitHub, GitLab, Bitbucket, Codeberg, Bugzilla, email) via the feedback-o-tron engine. Includes deduplication against existing issues and audit logging. When template_data is supplied the answers are validated against the target repo's issue-form schema (fail closed) and rendered as the issue body. Use dry_run to preview without filing.",
      "inputSchema": {
        "type": "object",
        "properties": {
          "title": {
            "type": "string",
            "description": "Issue/feedback title"
          },
          "body": {
            "type": "string",
            "description": "Issue/feedback body (markdown supported)"
          },
          "repo": {
            "type": "string",
            "description": "Target repository (owner/repo format)"
          },
          "platforms": {
            "type": "array",
            "items": {
              "type": "string",
              "enum": ["github", "gitlab", "bitbucket", "codeberg", "bugzilla", "email"]
            },
            "description": "Platforms to submit to (default: github)"
          },
          "labels": {
            "type": "array",
            "items": { "type": "string" },
            "description": "Labels to apply (platform-dependent)"
          },
          "template": {
            "type": "string",
            "description": "Issue-form template file this submission answers (e.g. bug.yml)"
          },
          "template_data": {
            "type": "object",
            "description": "Map of template field id -> answer; validated against the fetched form schema and rendered as the issue body"
          },
          "dry_run": {
            "type": "boolean",
            "description": "If true, show what would be submitted without actually submitting"
          },
          "skip_dedupe": {
            "type": "boolean",
            "description": "If true, skip duplicate checking"
          }
        },
        "required": ["title", "body", "repo"]
      }
    }
  ]
}
